{
  "schema": "llmdoc.meta/v3",
  "baseline": {
    "revision": "44cb75898c2a6711282f3c52b7820e8269b78a9e",
    "verifiedAt": "2026-08-24T14:23:30.023Z"
  },
  "documents": {
    "architecture.mdx": {
      "validatedRevision": "44cb75898c2a6711282f3c52b7820e8269b78a9e"
    },
    "cli-runtime/state-and-validation.mdx": {
      "validatedRevision": "44cb75898c2a6711282f3c52b7820e8269b78a9e"
    },
    "cli-runtime/retrieval-and-mutation.mdx": {
      "validatedRevision": "44cb75898c2a6711282f3c52b7820e8269b78a9e"
    },
    "plugin-packaging/claude-and-codex.mdx": {
      "validatedRevision": "74649afd7e04472f67415d7cd30dcc7e33f0825f"
    },
    "plugin-packaging/development-and-release.mdx": {
      "validatedRevision": "44cb75898c2a6711282f3c52b7820e8269b78a9e"
    },
    "workflows/init-and-update.mdx": {
      "validatedRevision": "44cb75898c2a6711282f3c52b7820e8269b78a9e"
    },
    "workflows/prune-and-upgrade.mdx": {
      "validatedRevision": "44cb75898c2a6711282f3c52b7820e8269b78a9e"
    }
  },
  "convergence": {
    "capturedAt": "2026-08-24T08:46:26Z",
    "source": "init",
    "documentCount": 7,
    "totalEstimatedTokens": 2003
  }
}
